{
  "$schema": "http://json-schema.org/draft-07/schema#",
  "title": "grammy_creators_db.producers",
  "description": "Formal MongoDB schema for producers collection in grammy_creators_db",
  "type": "object",
  "required": [
    "producer_id",
    "creator_id",
    "primary_production_genre",
    "headquarters_studio_location",
    "production_company_affiliation",
    "analog_digital_workflow_preference",
    "total_career_credits_count",
    "discogs_producer_id",
    "first_notable_production_year",
    "signature_sound_profile"
  ],
  "properties": {
    "producer_id": {
      "type": "string",
      "description": "Domain attribute: producer_id"
    },
    "creator_id": {
      "type": "string",
      "description": "Domain attribute: creator_id"
    },
    "primary_production_genre": {
      "type": "string",
      "description": "Domain attribute: primary_production_genre"
    },
    "headquarters_studio_location": {
      "type": "string",
      "description": "Domain attribute: headquarters_studio_location"
    },
    "production_company_affiliation": {
      "type": "string",
      "description": "Domain attribute: production_company_affiliation"
    },
    "analog_digital_workflow_preference": {
      "type": "string",
      "description": "Domain attribute: analog_digital_workflow_preference"
    },
    "total_career_credits_count": {
      "type": "integer",
      "description": "Domain attribute: total_career_credits_count"
    },
    "discogs_producer_id": {
      "type": "string",
      "description": "Domain attribute: discogs_producer_id"
    },
    "first_notable_production_year": {
      "type": "integer",
      "description": "Domain attribute: first_notable_production_year"
    },
    "signature_sound_profile": {
      "type": "string",
      "description": "Domain attribute: signature_sound_profile"
    }
  },
  "additionalProperties": true
}