[
  {
    "producer_id": "PROD_001",
    "creator_id": "CRT_NEL_BLU_DIPINTO_DI_BLU_VOLARE_0000",
    "primary_production_genre": "Pop / Vocal",
    "headquarters_studio_location": "Los Angeles, CA",
    "production_company_affiliation": "Nel Blu Dipinto Di Blu (Volare) Production Group",
    "analog_digital_workflow_preference": "Hybrid Analog/DAW",
    "total_career_credits_count": 45,
    "discogs_producer_id": "discogs-p-1000",
    "first_notable_production_year": 1960,
    "signature_sound_profile": "Acoustic warmth and dynamic range optimization"
  },
  {
    "producer_id": "PROD_002",
    "creator_id": "CRT_HENRY_MANCINI_0001",
    "primary_production_genre": "Rock",
    "headquarters_studio_location": "New York, NY",
    "production_company_affiliation": "Henry Mancini Production Group",
    "analog_digital_workflow_preference": "Hybrid Analog/DAW",
    "total_career_credits_count": 47,
    "discogs_producer_id": "discogs-p-1001",
    "first_notable_production_year": 1961,
    "signature_sound_profile": "Acoustic warmth and dynamic range optimization"
  },
  {
    "producer_id": "PROD_003",
    "creator_id": "CRT_ELLA_FITZGERALD_0002",
    "primary_production_genre": "R&B / Soul",
    "headquarters_studio_location": "Los Angeles, CA",
    "production_company_affiliation": "Ella Fitzgerald Production Group",
    "analog_digital_workflow_preference": "Hybrid Analog/DAW",
    "total_career_credits_count": 49,
    "discogs_producer_id": "discogs-p-1002",
    "first_notable_production_year": 1962,
    "signature_sound_profile": "Acoustic warmth and dynamic range optimization"
  },
  {
    "producer_id": "PROD_004",
    "creator_id": "CRT_CATCH_A_FALLING_STAR_0003",
    "primary_production_genre": "Jazz",
    "headquarters_studio_location": "New York, NY",
    "production_company_affiliation": "Catch A Falling Star Production Group",
    "analog_digital_workflow_preference": "Hybrid Analog/DAW",
    "total_career_credits_count": 51,
    "discogs_producer_id": "discogs-p-1003",
    "first_notable_production_year": 1963,
    "signature_sound_profile": "Acoustic warmth and dynamic range optimization"
  },
  {
    "producer_id": "PROD_005",
    "creator_id": "CRT_BILLY_MAY_S_BIG_FAT_BRASS_0004",
    "primary_production_genre": "Pop / Vocal",
    "headquarters_studio_location": "Los Angeles, CA",
    "production_company_affiliation": "Billy May's Big Fat Brass Production Group",
    "analog_digital_workflow_preference": "Hybrid Analog/DAW",
    "total_career_credits_count": 53,
    "discogs_producer_id": "discogs-p-1004",
    "first_notable_production_year": 1964,
    "signature_sound_profile": "Acoustic warmth and dynamic range optimization"
  },
  {
    "producer_id": "PROD_006",
    "creator_id": "CRT_BASIE_0005",
    "primary_production_genre": "Rock",
    "headquarters_studio_location": "New York, NY",
    "production_company_affiliation": "Basie Production Group",
    "analog_digital_workflow_preference": "Hybrid Analog/DAW",
    "total_career_credits_count": 55,
    "discogs_producer_id": "discogs-p-1005",
    "first_notable_production_year": 1965,
    "signature_sound_profile": "Acoustic warmth and dynamic range optimization"
  },
  {
    "producer_id": "PROD_007",
    "creator_id": "CRT_THAT_OLD_BLACK_MAGIC_0006",
    "primary_production_genre": "R&B / Soul",
    "headquarters_studio_location": "Los Angeles, CA",
    "production_company_affiliation": "That Old Black Magic Production Group",
    "analog_digital_workflow_preference": "Hybrid Analog/DAW",
    "total_career_credits_count": 57,
    "discogs_producer_id": "discogs-p-1006",
    "first_notable_production_year": 1966,
    "signature_sound_profile": "Acoustic warmth and dynamic range optimization"
  },
  {
    "producer_id": "PROD_008",
    "creator_id": "CRT_THE_CHIPMUNK_SONG_0007",
    "primary_production_genre": "Jazz",
    "headquarters_studio_location": "New York, NY",
    "production_company_affiliation": "The Chipmunk Song Production Group",
    "analog_digital_workflow_preference": "Hybrid Analog/DAW",
    "total_career_credits_count": 59,
    "discogs_producer_id": "discogs-p-1007",
    "first_notable_production_year": 1967,
    "signature_sound_profile": "Acoustic warmth and dynamic range optimization"
  },
  {
    "producer_id": "PROD_009",
    "creator_id": "CRT_TOM_DOOLEY_0008",
    "primary_production_genre": "Pop / Vocal",
    "headquarters_studio_location": "Los Angeles, CA",
    "production_company_affiliation": "Tom Dooley Production Group",
    "analog_digital_workflow_preference": "Hybrid Analog/DAW",
    "total_career_credits_count": 61,
    "discogs_producer_id": "discogs-p-1008",
    "first_notable_production_year": 1968,
    "signature_sound_profile": "Acoustic warmth and dynamic range optimization"
  },
  {
    "producer_id": "PROD_010",
    "creator_id": "CRT_TEQUILA_0009",
    "primary_production_genre": "Rock",
    "headquarters_studio_location": "New York, NY",
    "production_company_affiliation": "Tequila Production Group",
    "analog_digital_workflow_preference": "Hybrid Analog/DAW",
    "total_career_credits_count": 63,
    "discogs_producer_id": "discogs-p-1009",
    "first_notable_production_year": 1969,
    "signature_sound_profile": "Acoustic warmth and dynamic range optimization"
  },
  {
    "producer_id": "PROD_011",
    "creator_id": "CRT_DUETS_WITH_A_SPANISH_GUITAR_0010",
    "primary_production_genre": "R&B / Soul",
    "headquarters_studio_location": "Los Angeles, CA",
    "production_company_affiliation": "Duets With A Spanish Guitar Production Group",
    "analog_digital_workflow_preference": "Hybrid Analog/DAW",
    "total_career_credits_count": 65,
    "discogs_producer_id": "discogs-p-1010",
    "first_notable_production_year": 1970,
    "signature_sound_profile": "Acoustic warmth and dynamic range optimization"
  },
  {
    "producer_id": "PROD_012",
    "creator_id": "CRT_FRANK_SINATRA_0011",
    "primary_production_genre": "Jazz",
    "headquarters_studio_location": "New York, NY",
    "production_company_affiliation": "Frank Sinatra Production Group",
    "analog_digital_workflow_preference": "Hybrid Analog/DAW",
    "total_career_credits_count": 67,
    "discogs_producer_id": "discogs-p-1011",
    "first_notable_production_year": 1971,
    "signature_sound_profile": "Acoustic warmth and dynamic range optimization"
  },
  {
    "producer_id": "PROD_013",
    "creator_id": "CRT_CROSS_COUNTRY_SUITE_0012",
    "primary_production_genre": "Pop / Vocal",
    "headquarters_studio_location": "Los Angeles, CA",
    "production_company_affiliation": "Cross Country Suite Production Group",
    "analog_digital_workflow_preference": "Hybrid Analog/DAW",
    "total_career_credits_count": 69,
    "discogs_producer_id": "discogs-p-1012",
    "first_notable_production_year": 1972,
    "signature_sound_profile": "Acoustic warmth and dynamic range optimization"
  },
  {
    "producer_id": "PROD_014",
    "creator_id": "CRT_THE_MUSIC_MAN_0013",
    "primary_production_genre": "Rock",
    "headquarters_studio_location": "New York, NY",
    "production_company_affiliation": "The Music Man Production Group",
    "analog_digital_workflow_preference": "Hybrid Analog/DAW",
    "total_career_credits_count": 71,
    "discogs_producer_id": "discogs-p-1013",
    "first_notable_production_year": 1973,
    "signature_sound_profile": "Acoustic warmth and dynamic range optimization"
  },
  {
    "producer_id": "PROD_015",
    "creator_id": "CRT_ANDR_PREVIN_0014",
    "primary_production_genre": "R&B / Soul",
    "headquarters_studio_location": "Los Angeles, CA",
    "production_company_affiliation": "Andr\u00e9 Previn Production Group",
    "analog_digital_workflow_preference": "Hybrid Analog/DAW",
    "total_career_credits_count": 73,
    "discogs_producer_id": "discogs-p-1014",
    "first_notable_production_year": 1974,
    "signature_sound_profile": "Acoustic warmth and dynamic range optimization"
  },
  {
    "producer_id": "PROD_016",
    "creator_id": "CRT_THE_BEST_OF_THE_STAN_FREBERG_S_0015",
    "primary_production_genre": "Jazz",
    "headquarters_studio_location": "New York, NY",
    "production_company_affiliation": "The Best Of The Stan Freberg Shows Production Group",
    "analog_digital_workflow_preference": "Hybrid Analog/DAW",
    "total_career_credits_count": 75,
    "discogs_producer_id": "discogs-p-1015",
    "first_notable_production_year": 1975,
    "signature_sound_profile": "Acoustic warmth and dynamic range optimization"
  },
  {
    "producer_id": "PROD_017",
    "creator_id": "CRT_GAIETE_PARISIENNE_0016",
    "primary_production_genre": "Pop / Vocal",
    "headquarters_studio_location": "Los Angeles, CA",
    "production_company_affiliation": "Gaiete Parisienne Production Group",
    "analog_digital_workflow_preference": "Hybrid Analog/DAW",
    "total_career_credits_count": 77,
    "discogs_producer_id": "discogs-p-1016",
    "first_notable_production_year": 1976,
    "signature_sound_profile": "Acoustic warmth and dynamic range optimization"
  },
  {
    "producer_id": "PROD_018",
    "creator_id": "CRT_TCHAIKOVSKY_PIANO_CONCERTO_NO__0017",
    "primary_production_genre": "Rock",
    "headquarters_studio_location": "New York, NY",
    "production_company_affiliation": "Tchaikovsky: Piano Concerto No. 1 In B Flat Minor, Op. 23 Production Group",
    "analog_digital_workflow_preference": "Hybrid Analog/DAW",
    "total_career_credits_count": 79,
    "discogs_producer_id": "discogs-p-1017",
    "first_notable_production_year": 1977,
    "signature_sound_profile": "Acoustic warmth and dynamic range optimization"
  },
  {
    "producer_id": "PROD_019",
    "creator_id": "CRT_SEGOVIA_GOLDEN_JUBILEE_0018",
    "primary_production_genre": "R&B / Soul",
    "headquarters_studio_location": "Los Angeles, CA",
    "production_company_affiliation": "Segovia Golden Jubilee Production Group",
    "analog_digital_workflow_preference": "Hybrid Analog/DAW",
    "total_career_credits_count": 81,